{
  "$schema": "http://json-schema.org/draft-07/schema#",
  "$id": "https://sfia.local/schemas/v3-modeled/project/project.schema.json",
  "title": "Project",
  "description": "SFIA Studio project instance (D1). schemaVersion 0.1.0-d1",
  "type": "object",
  "additionalProperties": false,
  "required": [
    "projectId",
    "workspaceId",
    "title",
    "state",
    "schemaVersion",
    "createdAt",
    "createdBy",
    "doctrine"
  ],
  "properties": {
    "schemaVersion": {
      "type": "string",
      "const": "0.1.0-d1"
    },
    "projectId": {
      "$ref": "../common/identifier.schema.json"
    },
    "workspaceId": {
      "$ref": "../common/identifier.schema.json"
    },
    "title": {
      "type": "string",
      "minLength": 1,
      "maxLength": 200
    },
    "state": {
      "type": "string",
      "enum": [
        "DRAFT",
        "ACTIVE",
        "PAUSED",
        "CLOSED",
        "ARCHIVED"
      ]
    },
    "methodMode": {
      "type": "string",
      "enum": [
        "v2.6_manual",
        "v2.6_assisted",
        "transition",
        "v3_studio_native",
        "fallback"
      ]
    },
    "doctrine": {
      "$ref": "../common/doctrine-reference.schema.json"
    },
    "createdAt": {
      "$ref": "../common/timestamp.schema.json"
    },
    "updatedAt": {
      "$ref": "../common/timestamp.schema.json"
    },
    "createdBy": {
      "$ref": "../common/actor-reference.schema.json"
    },
    "ownerActorId": {
      "$ref": "../common/identifier.schema.json"
    }
  }
}
