{
  "schemaVersion": "0.1.0-d1",
  "projectId": "proj-demo-framing-001",
  "workspaceId": "ws-demo-001",
  "title": "Demo Project Framing D1",
  "state": "DRAFT",
  "methodMode": "transition",
  "doctrine": {
    "doctrineVersion": "SFIA-v2.6",
    "methodMode": "transition",
    "definitionDigests": {
      "projects/sfia-studio/sfia-v3-framing/29-sfia-v3-option-d-bounded-codesign-trajectory.md": "aaaaaaaaaaaaaaaaaaaaaaaaaaaaaaaaaaaaaaaaaaaaaaaaaaaaaaaaaaaaaaaa"
    }
  },
  "createdAt": "2026-07-22T15:00:00.000Z",
  "updatedAt": "2026-07-22T15:05:00.000Z",
  "createdBy": {
    "actorId": "actor-owner",
    "role": "project_owner"
  },
  "ownerActorId": "actor-owner"
}
